<?xml version="1.0" encoding="ISO-8859-1"?>

<footprint xmlns:xsi="http://www.w3.org/2001/XMLSchema-instance"
  xsi:noNamespaceSchemaLocation="footprint.xsd">

	<ticket>
		<mrID></mrID>
		<mrREF_TO_AB></mrREF_TO_AB>
		<mrREF_TO_MR></mrREF_TO_MR>
		<mrTITLE></mrTITLE>
		<mrPRIORITY></mrPRIORITY>
		<mrSTATUS></mrSTATUS>
		<mrDESCRIPTION></mrDESCRIPTION>
		<mrALLDESCRIPTIONS></mrALLDESCRIPTIONS>
		<mrASSIGNEES></mrASSIGNEES>
		<mrATTACHMENTS></mrATTACHMENTS>
		<mrUPDATEDATE></mrUPDATEDATE>
		<mrSUBMITTER></mrSUBMITTER>
		<mrSUBMITDATE></mrSUBMITDATE>
		<mrPOPULARITY></mrPOPULARITY>
		<mrUNASSIGNED></mrUNASSIGNED>
		<mrTIMESTAMP></mrTIMESTAMP>
		<mrURGENT></mrURGENT>
		<mrSUBTASK_ORDER></mrSUBTASK_ORDER>
		<mrREF_TO_MRX></mrREF_TO_MRX>
		<mrESCALATEDBY></mrESCALATEDBY>
		<Problem__bType></Problem__bType>
		<Issue__bType></Issue__bType>
		<Symptom></Symptom>
		<Error__bMessage></Error__bMessage>
		<Follow__bUp__bDate></Follow__bUp__bDate>
		<Work__bScheduled></Work__bScheduled>
		<Work__bScheduled__bLink></Work__bScheduled__bLink>
		<Submission></Submission>
		<IP__bAddress></IP__bAddress>
		<Memory></Memory>
		<Hard__bDisk__bSize></Hard__bDisk__bSize>
		<CPU__bType></CPU__bType>
		<CPU__bSpeed></CPU__bSpeed>
		<OS></OS>
		<Machine__bType></Machine__bType>
		<Manufacturer></Manufacturer>
		<Serial__bNumber></Serial__bNumber>
		<mrSOLUTION_TYPE></mrSOLUTION_TYPE>
		<SERVICE_REQUEST_CI_TYPE_ID></SERVICE_REQUEST_CI_TYPE_ID>
		<mrNAMP_ID></mrNAMP_ID>
	</ticket>

	<ticket_history>
		<mrID></mrID>
		<mrREF_TO_AB></mrREF_TO_AB>
		<mrREF_TO_MR></mrREF_TO_MR>
		<mrTITLE></mrTITLE>
		<mrPRIORITY></mrPRIORITY>
		<mrSTATUS></mrSTATUS>
		<mrDESCRIPTION></mrDESCRIPTION>
		<mrALLDESCRIPTIONS></mrALLDESCRIPTIONS>
		<mrASSIGNEES></mrASSIGNEES>
		<mrATTACHMENTS></mrATTACHMENTS>
		<mrUPDATEDATE></mrUPDATEDATE>
		<mrSUBMITTER></mrSUBMITTER>
		<mrSUBMITDATE></mrSUBMITDATE>
		<mrPOPULARITY></mrPOPULARITY>
		<mrUNASSIGNED></mrUNASSIGNED>
		<mrTIMESTAMP></mrTIMESTAMP>
		<mrURGENT></mrURGENT>
		<mrSUBTASK_ORDER></mrSUBTASK_ORDER>
		<mrREF_TO_MRX></mrREF_TO_MRX>
		<mrESCALATEDBY></mrESCALATEDBY>
		<Problem__bType></Problem__bType>
		<Issue__bType></Issue__bType>
		<Symptom></Symptom>
		<Error__bMessage></Error__bMessage>
		<Follow__bUp__bDate></Follow__bUp__bDate>
		<Work__bScheduled></Work__bScheduled>
		<Work__bScheduled__bLink></Work__bScheduled__bLink>
		<Submission></Submission>
		<IP__bAddress></IP__bAddress>
		<Memory></Memory>
		<Hard__bDisk__bSize></Hard__bDisk__bSize>
		<CPU__bType></CPU__bType>
		<CPU__bSpeed></CPU__bSpeed>
		<OS></OS>
		<Machine__bType></Machine__bType>
		<Manufacturer></Manufacturer>
		<Serial__bNumber></Serial__bNumber>
		<mrSOLUTION_TYPE></mrSOLUTION_TYPE>
		<SERVICE_REQUEST_CI_TYPE_ID></SERVICE_REQUEST_CI_TYPE_ID>
		<mrNAMP_ID></mrNAMP_ID>
	</ticket_history>

	<timetracking>
		<mrID></mrID>
		<mrGENERATION></mrGENERATION>
		<mrTIMESPENT></mrTIMESPENT>
		<mrRATE></mrRATE>
		<mrTIMEDATE></mrTIMEDATE>
		<mrTIMEUSER></mrTIMEUSER>
		<mrRATEDESC></mrRATEDESC>
		<mrCOMMENT></mrCOMMENT>
	</timetracking>

</footprint>
